{
  "api_version": "xdebug.v1",
  "action": "window.verify",
  "target": {
    "session_id": "case_a"
  },
  "args": {
    "clock": "top.u.clk",
    "signals": {
      "valid": "top.u.valid"
    },
    "conditions": [
      {
        "expr": "valid == 1",
        "mode": "always"
      }
    ],
    "time_range": {
      "begin": "0ns",
      "end": "1us"
    }
  }
}
