{
  "api_version": "xdebug.v1",
  "action": "stream.config.load",
  "target": {
    "session_id": "wave0"
  },
  "args": {
    "mode": "replace",
    "streams": [
      {
        "name": "req_stream",
        "clock": "top.clk",
        "edge": "posedge",
        "reset": "!top.rst_n",
        "vld": "top.req_vld",
        "rdy": "top.req_rdy",
        "sop": "top.req_sop",
        "eop": "top.req_eop",
        "data_fields": {
          "opcode": "top.req_data[7:0]",
          "addr": "{top.addr_hi, top.addr_lo}",
          "is_wr": "top.req_cmd == 2'b01"
        }
      }
    ]
  }
}
